[
  {"id":"interactions-focus-visible","category":"interactions","severity":"MUST","statement":"Provide visible focus rings using :focus-visible, grouped with :focus-within where appropriate.","rationale":"Keyboard users must see where focus is.","tags":["keyboard","focus"],"source":"tebin AGENTS.md","media":["web"]},
  {"id":"interactions-no-outline-none","category":"interactions","severity":"NEVER","statement":"Never set outline: none without providing a visible focus replacement.","tags":["keyboard","focus"],"source":"tebin AGENTS.md","media":["web"]},
  {"id":"interactions-keyboard-apg","category":"interactions","severity":"MUST","statement":"Support full keyboard interaction per the WAI-ARIA Authoring Practices.","tags":["keyboard"],"source":"tebin AGENTS.md","media":["web"]},
  {"id":"touch-hit-target","category":"touch","severity":"MUST","statement":"Use hit targets of at least 24px (44px on mobile); expand the hit area if the visual is smaller.","tags":["touch","target"],"source":"tebin AGENTS.md","media":["web"]},
  {"id":"touch-action-manipulation","category":"touch","severity":"MUST","statement":"Set touch-action: manipulation to prevent double-tap zoom delays.","tags":["touch"],"source":"tebin AGENTS.md","media":["web"]},
  {"id":"forms-input-font-size","category":"forms","severity":"MUST","statement":"Use a font-size of at least 16px on mobile inputs to prevent iOS zoom.","tags":["forms","mobile"],"source":"tebin AGENTS.md","media":["web"]},
  {"id":"forms-loading-button","category":"forms","severity":"MUST","statement":"Loading buttons show a spinner and keep their original label.","rationale":"Avoids layout shift and keeps the action legible while pending.","tags":["button","loading","feedback"],"source":"tebin AGENTS.md","media":["web"]},
  {"id":"forms-no-block-paste","category":"forms","severity":"NEVER","statement":"Never block paste in inputs or textareas.","tags":["forms","paste"],"source":"tebin AGENTS.md","media":["web"]},
  {"id":"forms-enter-submits","category":"forms","severity":"MUST","statement":"Enter submits a focused single-line input; in a textarea, Cmd/Ctrl+Enter submits.","tags":["forms","keyboard"],"source":"tebin AGENTS.md","media":["web"]},
  {"id":"forms-errors-inline","category":"forms","severity":"MUST","statement":"Show validation errors inline next to fields and focus the first error on submit.","tags":["forms","validation"],"source":"tebin AGENTS.md","media":["web"]},
  {"id":"forms-autocomplete","category":"forms","severity":"MUST","statement":"Set autocomplete and a meaningful name, with the correct type and inputmode.","tags":["forms"],"source":"tebin AGENTS.md","media":["web"]},
  {"id":"forms-warn-unsaved","category":"forms","severity":"MUST","statement":"Warn before navigating away from unsaved changes.","tags":["forms"],"source":"tebin AGENTS.md","media":["web"]},
  {"id":"navigation-anchor-links","category":"navigation","severity":"MUST","statement":"Use <a>/<Link> for navigation so Cmd/Ctrl/middle-click work.","tags":["navigation","links"],"source":"tebin AGENTS.md","media":["web"]},
  {"id":"navigation-no-div-onclick","category":"navigation","severity":"NEVER","statement":"Never use a div with onClick for navigation.","tags":["navigation"],"source":"tebin AGENTS.md","media":["web"]},
  {"id":"navigation-url-reflects-state","category":"navigation","severity":"MUST","statement":"Reflect state in the URL (filters, tabs, pagination, expanded panels) for deep-linking.","tags":["navigation","state"],"source":"tebin AGENTS.md","media":["web"]},
  {"id":"feedback-confirm-destructive","category":"feedback","severity":"MUST","statement":"Confirm destructive actions or provide an Undo window.","tags":["feedback","safety"],"source":"tebin AGENTS.md","media":["web"]},
  {"id":"feedback-aria-live","category":"feedback","severity":"MUST","statement":"Announce toasts and inline validation with a polite aria-live region.","tags":["feedback","accessibility"],"source":"tebin AGENTS.md","media":["web"]},
  {"id":"feedback-optimistic","category":"feedback","severity":"SHOULD","statement":"Use optimistic UI; reconcile on response and roll back or offer Undo on failure.","tags":["feedback"],"source":"tebin AGENTS.md","media":["web"]},
  {"id":"animation-reduced-motion","category":"animation","severity":"MUST","statement":"Honor prefers-reduced-motion with a reduced or disabled variant.","tags":["animation","accessibility"],"source":"tebin AGENTS.md","media":["web"]},
  {"id":"animation-compositor-props","category":"animation","severity":"MUST","statement":"Animate only compositor-friendly properties (transform, opacity).","rationale":"Avoids layout thrash and jank.","tags":["animation","performance"],"source":"tebin AGENTS.md","media":["web"]},
  {"id":"animation-no-transition-all","category":"animation","severity":"NEVER","statement":"Never use transition: all; list the properties explicitly.","tags":["animation"],"source":"tebin AGENTS.md","media":["web"]},
  {"id":"animation-no-overshoot-ui","category":"animation","severity":"NEVER","statement":"Never use overshoot or bounce easing (a cubic-bezier whose second control point exceeds 1) on UI state — reveals, buttons, modals, tooltips.","rationale":"Overshoot on UI state is a recognised generated-design tell; reserve it for genuine physical interactions such as a drag release.","tags":["animation","easing"],"source":"tebin.pro audit 2026-07","media":["web"],"themes":["tebin"]},
  {"id":"animation-reveal-restraint","category":"animation","severity":"SHOULD","statement":"Limit scroll reveals to one orchestrated entrance plus the major content blocks; never stagger every item of a mapped list or fade in every section head.","rationale":"When everything animates on scroll the page never settles, and a staggered list is the clearest sign the reveal was applied by rule rather than by intent.","tags":["animation","scroll"],"source":"tebin.pro audit 2026-07","media":["web"],"themes":["tebin"]},
  {"id":"layout-test-breakpoints","category":"layout","severity":"MUST","statement":"Verify layouts on mobile, laptop, and ultra-wide (simulate ultra-wide at 50% zoom).","tags":["layout","responsive"],"source":"tebin AGENTS.md","media":["web"]},
  {"id":"layout-safe-areas","category":"layout","severity":"MUST","statement":"Respect safe areas using env(safe-area-inset-*).","tags":["layout","mobile"],"source":"tebin AGENTS.md","media":["web"]},
  {"id":"layout-flex-min-w-0","category":"layout","severity":"MUST","statement":"Give flex children min-width: 0 so they can truncate.","tags":["layout"],"source":"tebin AGENTS.md","media":["web"]},
  {"id":"content-native-semantics","category":"content","severity":"MUST","statement":"Prefer native semantics (button, a, label, table) before ARIA.","tags":["accessibility","semantics"],"source":"tebin AGENTS.md","media":["web"]},
  {"id":"content-icon-button-label","category":"content","severity":"MUST","statement":"Give icon-only buttons a descriptive aria-label.","tags":["accessibility"],"source":"tebin AGENTS.md","media":["web"]},
  {"id":"content-not-color-only","category":"content","severity":"MUST","statement":"Convey status with more than color alone; pair icons with text labels.","tags":["accessibility","color"],"source":"tebin AGENTS.md","media":["web"]},
  {"id":"content-tabular-nums","category":"content","severity":"MUST","statement":"Use font-variant-numeric: tabular-nums when comparing numbers in columns.","tags":["content","typography"],"source":"tebin AGENTS.md","media":["web"]},
  {"id":"content-no-redrawn-chrome","category":"content","severity":"NEVER","statement":"Never re-draw operating-system or browser chrome — traffic-light window bars, phone frames, fake IDE tabs — around a screenshot or code block; frame them typographically instead, with a rule, a filename and a rule.","rationale":"The reader already has real chrome; a painted-on copy is always slightly wrong and advertises that the surface is fake.","tags":["content","code","screenshot"],"source":"tebin.pro audit 2026-07","media":["web"],"themes":["tebin"]},
  {"id":"content-eyebrow-ordinal-only","category":"content","severity":"SHOULD","statement":"Use a numbered section eyebrow only where the content is genuinely ordinal, cap it at one or two per page, and stack the heading directly beneath it rather than beside it.","rationale":"Numbering every section erases the hierarchy it implies — when each one is a chapter, none is.","tags":["content","typography","hierarchy"],"source":"tebin.pro audit 2026-07","media":["web"],"themes":["tebin"]},
  {"id":"content-no-invented-claims","category":"content","severity":"NEVER","statement":"Never invent claims, certifications, prices, statistics, client names or quotes in branded material. Use only copy the user supplied or a source states, and mark a gap as a placeholder.","rationale":"A brand kit makes invented copy look official: a made-up figure set in the house style reads as a company statement.","tags":["content","copy","brand"],"source":"tebin-style #89"},
  {"id":"performance-prevent-cls","category":"performance","severity":"MUST","statement":"Set explicit image dimensions to prevent layout shift (CLS).","tags":["performance","images"],"source":"tebin AGENTS.md","media":["web"]},
  {"id":"performance-virtualize-lists","category":"performance","severity":"MUST","statement":"Virtualize large lists (more than about 50 items).","tags":["performance"],"source":"tebin AGENTS.md","media":["web"]},
  {"id":"performance-lazy-images","category":"performance","severity":"MUST","statement":"Preload above-the-fold images and lazy-load the rest.","tags":["performance","images"],"source":"tebin AGENTS.md","media":["web"]},
  {"id":"accessibility-no-disable-zoom","category":"accessibility","severity":"NEVER","statement":"Never disable browser zoom (user-scalable=no or maximum-scale=1).","tags":["accessibility","zoom"],"source":"tebin AGENTS.md","media":["web"]},